{"decisions":[],"policy_version":"economic-observation-v1","requested_end":"2026-10-04","requested_start":"2026-10-01","resolution_summary":{"decision_count":0,"eligible_for_aggregate_count":5383,"observation_count":5383,"suppressed_observation_count":0},"runs":[{"adapter_version":"1.0","content_hash":"sha256:972e8cc830d97dca780744cf0bbaf2a74a7c3baddbbe557970947c84f32690b5","dataset_semantics":"wholesale_market_daily_transaction","eligible_for_aggregate_count":5383,"http_status":200,"normalized_record_count":5383,"precedence":100,"raw_record_count":5383,"retrieved_at":"2026-10-04T06:49:26.966860+00:00","run_id":"sha256:a34965f82bc8e24c2220b9e3150dc4f71e441cc3677c24cb43435c820c855ce3","source_id":"moa_market_8066","source_role":"authoritative_final","source_schema_version":"moa-8066-v1","source_url":"https://data.moa.gov.tw/Service/OpenData/FromM/FarmTransData.aspx","status":"success","suppressed_observation_count":0}],"schema_version":"1.0"}