{"decisions":[{"candidates":[{"eligible_for_aggregate":false,"observation_id":"sha256:88d3dd4403dde1b0f801234d5d521034ebc1096c3ee01138fb9cf104e3287046","precedence":100,"source_id":"moa_market_8066","source_record_id":"sha256:8937aea4d0db708c56237d6cd1b12aee838c5212e9e7905344196149b5084ac3","source_role":"authoritative_final","supersedes_source_record_id":null},{"eligible_for_aggregate":true,"observation_id":"sha256:deb5a19a3b4e01a4e2faa5a3a3f80c5c6779da37c75080f7d7f87f6afb818c8c","precedence":100,"source_id":"moa_market_8066","source_record_id":"sha256:ad820beaf951775e74874248bd360aeaf7f70c21f931d21e45d75f398e3b9cc9","source_role":"authoritative_final","supersedes_source_record_id":"sha256:8937aea4d0db708c56237d6cd1b12aee838c5212e9e7905344196149b5084ac3"}],"observation_identity":{"crop_code":"rest","dataset_semantics":"wholesale_market_daily_transaction","market_code":"104","transaction_date":"2026-10-08"},"selected_observation_id":"sha256:deb5a19a3b4e01a4e2faa5a3a3f80c5c6779da37c75080f7d7f87f6afb818c8c"},{"candidates":[{"eligible_for_aggregate":false,"observation_id":"sha256:bf6ee7577fec1f3b68f9236f19e2ee912e12169e214cf69d5ab25e472a0518a6","precedence":100,"source_id":"moa_market_8066","source_record_id":"sha256:7917b1ea6e8040d7ae7ad03d302ebb3db41240e7c594d3d8b903db84ae51365d","source_role":"authoritative_final","supersedes_source_record_id":null},{"eligible_for_aggregate":true,"observation_id":"sha256:2aa7db580de55b64b6c3fb959b308a93d0affdfaafdce4cbab1a951c40ab893b","precedence":100,"source_id":"moa_market_8066","source_record_id":"sha256:3d4f6be2b167cb7862da17bab69a398149902d66a0088912526fcf9b97e0e67d","source_role":"authoritative_final","supersedes_source_record_id":"sha256:7917b1ea6e8040d7ae7ad03d302ebb3db41240e7c594d3d8b903db84ae51365d"}],"observation_identity":{"crop_code":"rest","dataset_semantics":"wholesale_market_daily_transaction","market_code":"109","transaction_date":"2026-10-08"},"selected_observation_id":"sha256:2aa7db580de55b64b6c3fb959b308a93d0affdfaafdce4cbab1a951c40ab893b"},{"candidates":[{"eligible_for_aggregate":false,"observation_id":"sha256:927d6f3204feffa57f74e8e82a423da37d9f695bacbaccf18ac6d2f7519fcb22","precedence":100,"source_id":"moa_market_8066","source_record_id":"sha256:a154e3a50723472799b97bf35d04f6bc0e957911fd5d0427ee7dafc73c6980bb","source_role":"authoritative_final","supersedes_source_record_id":null},{"eligible_for_aggregate":true,"observation_id":"sha256:a43f1060cfff3684f8e477ad1a6bc7735bf4bce7f29b20111300223aadecf6a8","precedence":100,"source_id":"moa_market_8066","source_record_id":"sha256:8ff5bfd84b4adf15baca58613524b0c91ed6dc16f2e3f07570865c59278c553f","source_role":"authoritative_final","supersedes_source_record_id":"sha256:a154e3a50723472799b97bf35d04f6bc0e957911fd5d0427ee7dafc73c6980bb"}],"observation_identity":{"crop_code":"rest","dataset_semantics":"wholesale_market_daily_transaction","market_code":"220","transaction_date":"2026-10-08"},"selected_observation_id":"sha256:a43f1060cfff3684f8e477ad1a6bc7735bf4bce7f29b20111300223aadecf6a8"},{"candidates":[{"eligible_for_aggregate":false,"observation_id":"sha256:b76fe1fbbb7a5e380919dfba7d7192aebbd682e8cba978295c2aca0ece458726","precedence":100,"source_id":"moa_market_8066","source_record_id":"sha256:7e2841bd2de6250dbbe83177dec612081685c1f7de5c68d52bfa19acc42ebdc5","source_role":"authoritative_final","supersedes_source_record_id":null},{"eligible_for_aggregate":true,"observation_id":"sha256:5afc022b6c84d05c917507826ec154586c7f3d4b371afcb1a2d58aef4509d799","precedence":100,"source_id":"moa_market_8066","source_record_id":"sha256:b76a38eff8f95f965106d577ca49ab665621e858df956cf47b3f5fbc1d4737e0","source_role":"authoritative_final","supersedes_source_record_id":"sha256:7e2841bd2de6250dbbe83177dec612081685c1f7de5c68d52bfa19acc42ebdc5"}],"observation_identity":{"crop_code":"rest","dataset_semantics":"wholesale_market_daily_transaction","market_code":"241","transaction_date":"2026-10-08"},"selected_observation_id":"sha256:5afc022b6c84d05c917507826ec154586c7f3d4b371afcb1a2d58aef4509d799"},{"candidates":[{"eligible_for_aggregate":false,"observation_id":"sha256:5cf95b78a1c8f15585e07c658a58765626e3d4a66bd03919ed0412d78c0a228c","precedence":100,"source_id":"moa_market_8066","source_record_id":"sha256:82695ca896676baa3249c7ab3103986fab9deca97a8639e7ce8a568127af8399","source_role":"authoritative_final","supersedes_source_record_id":null},{"eligible_for_aggregate":true,"observation_id":"sha256:fca900a61992d185799218818124a275ed02b025bdb0568de996cf21891f44e8","precedence":100,"source_id":"moa_market_8066","source_record_id":"sha256:9b37e5e76acd5212790d2003058226ddf9d4d2d704f0d133ac707270bf7d8de6","source_role":"authoritative_final","supersedes_source_record_id":"sha256:82695ca896676baa3249c7ab3103986fab9deca97a8639e7ce8a568127af8399"}],"observation_identity":{"crop_code":"rest","dataset_semantics":"wholesale_market_daily_transaction","market_code":"260","transaction_date":"2026-10-08"},"selected_observation_id":"sha256:fca900a61992d185799218818124a275ed02b025bdb0568de996cf21891f44e8"},{"candidates":[{"eligible_for_aggregate":false,"observation_id":"sha256:4774627c963189df484e0ac4f1000a2dd055dc77be8a61ff9480b5fdeffa6b1f","precedence":100,"source_id":"moa_market_8066","source_record_id":"sha256:477eef1aa7230b97a97dde9a66c95e85fe1908a4e8eecf6af0dc74742ffa1512","source_role":"authoritative_final","supersedes_source_record_id":null},{"eligible_for_aggregate":true,"observation_id":"sha256:4ed3db8ba52f2c5bbd01f1d75c82d579ec8b6a0ee681441859e6656ed23ce77b","precedence":100,"source_id":"moa_market_8066","source_record_id":"sha256:9a07e006184c3d5fb0ba813880c29609ca8c1128a4a07f3169069487c9787e64","source_role":"authoritative_final","supersedes_source_record_id":"sha256:477eef1aa7230b97a97dde9a66c95e85fe1908a4e8eecf6af0dc74742ffa1512"}],"observation_identity":{"crop_code":"rest","dataset_semantics":"wholesale_market_daily_transaction","market_code":"338","transaction_date":"2026-10-08"},"selected_observation_id":"sha256:4ed3db8ba52f2c5bbd01f1d75c82d579ec8b6a0ee681441859e6656ed23ce77b"},{"candidates":[{"eligible_for_aggregate":false,"observation_id":"sha256:214841a15f71294d392ce7007436127be7d84e682b8c5b933822b885930a048d","precedence":100,"source_id":"moa_market_8066","source_record_id":"sha256:f112396774eaa9183b7dce23ad2f07e5ebfda1b2cf73187dae4c620cf73c3110","source_role":"authoritative_final","supersedes_source_record_id":null},{"eligible_for_aggregate":true,"observation_id":"sha256:0c1eb6a659137c77b0783b7d7ca72da5efcbaf9c7b36ae937cbf549f0131cacd","precedence":100,"source_id":"moa_market_8066","source_record_id":"sha256:44713c10324fbbc2c5c15d273168d925191582cb075a5aa9c451320559e65623","source_role":"authoritative_final","supersedes_source_record_id":"sha256:f112396774eaa9183b7dce23ad2f07e5ebfda1b2cf73187dae4c620cf73c3110"}],"observation_identity":{"crop_code":"rest","dataset_semantics":"wholesale_market_daily_transaction","market_code":"400","transaction_date":"2026-10-08"},"selected_observation_id":"sha256:0c1eb6a659137c77b0783b7d7ca72da5efcbaf9c7b36ae937cbf549f0131cacd"}],"policy_version":"economic-observation-v1","requested_end":"2026-10-09","requested_start":"2026-10-06","resolution_summary":{"decision_count":7,"eligible_for_aggregate_count":7034,"observation_count":7041,"suppressed_observation_count":7},"runs":[{"adapter_version":"1.0","content_hash":"sha256:71736985c5f70b7efa672721522be9375958bab5ca3f8e6c07751096ca122424","dataset_semantics":"wholesale_market_daily_transaction","eligible_for_aggregate_count":7034,"http_status":200,"normalized_record_count":7041,"precedence":100,"raw_record_count":7041,"retrieved_at":"2026-10-08T17:26:36.818130+00:00","run_id":"sha256:5fa11699106d586db1f26e9b876ab1fa6fd1d4bd7ff2615927a815e69cb0d6db","source_id":"moa_market_8066","source_role":"authoritative_final","source_schema_version":"moa-8066-v1","source_url":"https://data.moa.gov.tw/Service/OpenData/FromM/FarmTransData.aspx","status":"success","suppressed_observation_count":7}],"schema_version":"1.0"}