{"decisions":[{"candidates":[{"eligible_for_aggregate":false,"observation_id":"sha256:3b0114f52f23e5165ce78407e41324fd4a6435fe9d8de734ecd919aeed9af6fb","precedence":100,"source_id":"moa_market_8066","source_record_id":"sha256:266ed9485eadfa4ce10a4d7a522e019953d84b52b35ce802fd41535fd792caa2","source_role":"authoritative_final","supersedes_source_record_id":null},{"eligible_for_aggregate":true,"observation_id":"sha256:555e5f0bec33a8737b46670b1e962abdeae885b775aca9a50529ce88f316d03f","precedence":100,"source_id":"moa_market_8066","source_record_id":"sha256:578ae1faa0041b8bf6c389f75d4ef8d5c0391522678a56695167776639db1f03","source_role":"authoritative_final","supersedes_source_record_id":"sha256:266ed9485eadfa4ce10a4d7a522e019953d84b52b35ce802fd41535fd792caa2"}],"observation_identity":{"crop_code":"rest","dataset_semantics":"wholesale_market_daily_transaction","market_code":"104","transaction_date":"2026-09-10"},"selected_observation_id":"sha256:555e5f0bec33a8737b46670b1e962abdeae885b775aca9a50529ce88f316d03f"},{"candidates":[{"eligible_for_aggregate":false,"observation_id":"sha256:a020ce843848afa2bff01bf11712f76f7a7431b39947a7f768d962a810199694","precedence":100,"source_id":"moa_market_8066","source_record_id":"sha256:f691a50aa2e3355fd339b087248b9b54b6cf909eb2ecba6a2fcfb4dced07540d","source_role":"authoritative_final","supersedes_source_record_id":null},{"eligible_for_aggregate":true,"observation_id":"sha256:7953bb44e77f43cb6288681a857ddbe32bd6e84df7c7edd1c00b81f3a08b70a1","precedence":100,"source_id":"moa_market_8066","source_record_id":"sha256:c3696222b382ec9ddb36fc5c718b5a7d576adfeb81f8c0580d1c847072699426","source_role":"authoritative_final","supersedes_source_record_id":"sha256:f691a50aa2e3355fd339b087248b9b54b6cf909eb2ecba6a2fcfb4dced07540d"}],"observation_identity":{"crop_code":"rest","dataset_semantics":"wholesale_market_daily_transaction","market_code":"109","transaction_date":"2026-09-10"},"selected_observation_id":"sha256:7953bb44e77f43cb6288681a857ddbe32bd6e84df7c7edd1c00b81f3a08b70a1"},{"candidates":[{"eligible_for_aggregate":false,"observation_id":"sha256:154b174a29b88e099e3197f3a52f5eeb8657c55a9c56a6d311bdd546261292b7","precedence":100,"source_id":"moa_market_8066","source_record_id":"sha256:c325ae722a79b95ff696ee84da44667aa7c550854d23f8f98d2bd998b06e8471","source_role":"authoritative_final","supersedes_source_record_id":null},{"eligible_for_aggregate":true,"observation_id":"sha256:129fb10443b0a38e8403c5242671f28ead3d974949a4d2de148d4cebb8699ebc","precedence":100,"source_id":"moa_market_8066","source_record_id":"sha256:c5aa535e18429984f6fe1a392e786f9d3635c21148a5135b6120fe93501b84c4","source_role":"authoritative_final","supersedes_source_record_id":"sha256:c325ae722a79b95ff696ee84da44667aa7c550854d23f8f98d2bd998b06e8471"}],"observation_identity":{"crop_code":"rest","dataset_semantics":"wholesale_market_daily_transaction","market_code":"220","transaction_date":"2026-09-10"},"selected_observation_id":"sha256:129fb10443b0a38e8403c5242671f28ead3d974949a4d2de148d4cebb8699ebc"},{"candidates":[{"eligible_for_aggregate":false,"observation_id":"sha256:e0a368cedf3de7a331998718c1e1d0f55d41721ac9b8137e73e99be7173e2276","precedence":100,"source_id":"moa_market_8066","source_record_id":"sha256:005a67c7ee53c7b5f86a94387fd87481b068f02400c696e63d8a634d25499477","source_role":"authoritative_final","supersedes_source_record_id":null},{"eligible_for_aggregate":true,"observation_id":"sha256:b0310f2ffb538b0e0c72e0dd7dce7f3bad22acf38b5cbbd88bf6c80e30e5d52e","precedence":100,"source_id":"moa_market_8066","source_record_id":"sha256:fcd61af3851076138624e09ba8a20009cbdf1a56b2796ce135ffa43c7efbfe3a","source_role":"authoritative_final","supersedes_source_record_id":"sha256:005a67c7ee53c7b5f86a94387fd87481b068f02400c696e63d8a634d25499477"}],"observation_identity":{"crop_code":"rest","dataset_semantics":"wholesale_market_daily_transaction","market_code":"241","transaction_date":"2026-09-10"},"selected_observation_id":"sha256:b0310f2ffb538b0e0c72e0dd7dce7f3bad22acf38b5cbbd88bf6c80e30e5d52e"},{"candidates":[{"eligible_for_aggregate":false,"observation_id":"sha256:69c6cd8a2b0a04bed5fa5e5dc3cab2b815f86b0ab5e2d19e6b6b16c712a5dda9","precedence":100,"source_id":"moa_market_8066","source_record_id":"sha256:10391d726526abfc08ede8465b6a2aef088283e01b4281d689c403db7d1bd9d3","source_role":"authoritative_final","supersedes_source_record_id":null},{"eligible_for_aggregate":true,"observation_id":"sha256:a5df6bffd5ce2c092f4cc48cc5fbb651768b21db263b3c9a338a0cdf6586fb58","precedence":100,"source_id":"moa_market_8066","source_record_id":"sha256:1c33da1a5ee6fed6a8458b22c99de26bed458bec944650614935eb832e680c0b","source_role":"authoritative_final","supersedes_source_record_id":"sha256:10391d726526abfc08ede8465b6a2aef088283e01b4281d689c403db7d1bd9d3"}],"observation_identity":{"crop_code":"rest","dataset_semantics":"wholesale_market_daily_transaction","market_code":"260","transaction_date":"2026-09-10"},"selected_observation_id":"sha256:a5df6bffd5ce2c092f4cc48cc5fbb651768b21db263b3c9a338a0cdf6586fb58"},{"candidates":[{"eligible_for_aggregate":false,"observation_id":"sha256:9b52229b0350d06d5e1eafd3a21023935686a7d7eb14417f0139ffb34153c478","precedence":100,"source_id":"moa_market_8066","source_record_id":"sha256:2ab1c4247b08425e46eed9dfde9a5a7bcf32f93f16e232bea4d75719708a4fd6","source_role":"authoritative_final","supersedes_source_record_id":null},{"eligible_for_aggregate":true,"observation_id":"sha256:e5d8e83cd6997961b33b0c9b448a9b719005fe06d9d15bf8ff9a945914b9b23f","precedence":100,"source_id":"moa_market_8066","source_record_id":"sha256:6e859e8137419ecfa91e92e2966a19063bff73db76e9b522cf42249bb0d0370a","source_role":"authoritative_final","supersedes_source_record_id":"sha256:2ab1c4247b08425e46eed9dfde9a5a7bcf32f93f16e232bea4d75719708a4fd6"}],"observation_identity":{"crop_code":"rest","dataset_semantics":"wholesale_market_daily_transaction","market_code":"338","transaction_date":"2026-09-10"},"selected_observation_id":"sha256:e5d8e83cd6997961b33b0c9b448a9b719005fe06d9d15bf8ff9a945914b9b23f"},{"candidates":[{"eligible_for_aggregate":false,"observation_id":"sha256:411b9b13ebb399eb0594c1d5753660927b828dfbc35ddec69746ad97ef2a9e7e","precedence":100,"source_id":"moa_market_8066","source_record_id":"sha256:587591117fab10efa0f4419c9e1742666f2633c95d7d76fbe60ee55ff783ebaa","source_role":"authoritative_final","supersedes_source_record_id":null},{"eligible_for_aggregate":true,"observation_id":"sha256:93634aa4496b56f436b9575bb29c635434e733f9f99663a087a045d2ea690ee3","precedence":100,"source_id":"moa_market_8066","source_record_id":"sha256:bc1ae5c1f4e0174f64e045b564a1c2374e2d355f2564e84a9cc04c4178bff0fc","source_role":"authoritative_final","supersedes_source_record_id":"sha256:587591117fab10efa0f4419c9e1742666f2633c95d7d76fbe60ee55ff783ebaa"}],"observation_identity":{"crop_code":"rest","dataset_semantics":"wholesale_market_daily_transaction","market_code":"400","transaction_date":"2026-09-10"},"selected_observation_id":"sha256:93634aa4496b56f436b9575bb29c635434e733f9f99663a087a045d2ea690ee3"}],"policy_version":"economic-observation-v1","requested_end":"2026-09-12","requested_start":"2026-09-09","resolution_summary":{"decision_count":7,"eligible_for_aggregate_count":7046,"observation_count":7053,"suppressed_observation_count":7},"runs":[{"adapter_version":"1.0","content_hash":"sha256:0237c0b403d69afe39e9cc91a1b6d806da72a85c6834cb20eba14c6782e8825d","dataset_semantics":"wholesale_market_daily_transaction","eligible_for_aggregate_count":7046,"http_status":200,"normalized_record_count":7053,"precedence":100,"raw_record_count":7053,"retrieved_at":"2026-09-12T02:31:41.240151+00:00","run_id":"sha256:d698f404bf675962a0cb2fa2165c75ca88dd49286cbda537d96927f6dc2ade91","source_id":"moa_market_8066","source_role":"authoritative_final","source_schema_version":"moa-8066-v1","source_url":"https://data.moa.gov.tw/Service/OpenData/FromM/FarmTransData.aspx","status":"success","suppressed_observation_count":7}],"schema_version":"1.0"}